2020/08/04,"South African Maritime Safety
Authority","License Renewal for OpenText:
Maintenance and Support",Not Stated,"6 100 000,00",Close bidding process,Conditional Support,2020/08/04,Not stated,Not stated
2020/08/03,"South African Maritime Safety
Authority","License Renewal for Veeam Backup and
Replication: Maintenance and Support",Not Stated,"5 796 827,37",Close bidding process,Conditional Support,2020/08/03,Not stated,Not stated
2020/07/06,South African National Parks,"Reporting :Business Intelligence support
for Panorama Necto and Profitbass",Khasani Business Enterprise,"8 050 000,00",Sole Source procurement,Noting,2020/7/2,2020/9/1,2024/8/31
2020/07/06,South African National Parks,"Reporting:Human resources
management audit for Sanparks",SABPP,"1 154 115,75",Sole Source procurement,Noting,2020/7/2,2019/11/01,2020/3/31
2020/07/06,South African National Parks,"Reporting :Safran Helicopter Engines
South Africa",Safran,"5 000 000,00",Sole Source procurement,Noting,2020/7/2,2020/3/1,2020/2/28
2020/07/06,South African National Parks,"Reporting :Specialised maintenance and
supply of new parts & components to
SANParks helicopter fleet",Airbus Helicopters South Africa,"5 000 000,00",Sole Source procurement,Noting,2020/7/2,2020/3/1,2021/2/28
2020/07/06,South African National Parks,"Reporting :Testing of Controlled animal
diseases",ARC (OVC),"3 506 040,00",Sole Source procurement,Noting,2020/7/2,2019/11/1,2024/10/31
2020/07/06,South African National Parks,Reporting:Genetics testing services,The National Zoological Garden,"1 350 000,00",Sole Source procurement,Noting,2020/7/2,2019/11/1,2024/10/31
2020/07/06,South African National Parks,"Reporting:Provision of hand soaps and
sanitizers",Supercare Hygiene (Pty) Ltd,8 800 00.00,Emergency procurement,Noting,2020/7/2,Once Off,Once Off
2020/07/06,,Reporting:Provision of hand sanitizers,Murwa Group,"1 792 850,00",Emergency procurement,Noting,2020/7/2,Once Off,Once Off
2020/07/06,South African National Parks,"Reporting :Supply and delivery of of food
parcels",Trustem Solution,"5 940 000,00",Emergency procurement,Noting,2020/7/2,Once Off,Once Off
2020/07/21,South African National Parks,Rental of mobile housing and ablution unit,"Kwikspace
Modular Buildings (Pty) Ltd","766 454,90",Single Source procurement,Not Supported,2020/7/21,Not Stated,Not Stated
2020/08/21,South African National Parks,Panel of Universities,Various Service Providers,Not Stated,Single Source procurement,Not Supported,2020/08/21,Not Stated,Not Stated
2020/08/04,South African National Roads Agency,Consulting engineering,"BVI Consulting Engineers Western Cape
(Pty) Ltd","165 163 110,52","Bidder whoc scored the highest oit
did not have capacity",Not Supported,2020/08/04,Not stated,Not stated
2020/08/04,South African National Roads Agency,Consulting engineering,Nyeleti Consulting,"123 298 069,52","Bidder whoc scored the highest oit
did not have capacity",Not Supported,2020/08/04,Not stated,Not stated
2020/08/04,South African National Roads Agency,Consulting engineering,Nyeleti Consulting,"129 979 685,64","Bidder whoc scored the highest oit
did not have capacity",Not Supported,2020/08/04,Not stated,Not stated
2020/08/04,South African National Roads Agency,Consulting engineering,Ilifa Engineers,"132 067 039,00","Bidder whoc scored the highest oit
did not have capacity",Not Supported,2020/08/04,Not stated,Not stated
2020/07/01,South African National Roads Agency,"OpenText Electronic Document
Management System",Closed bidding (No supplier),"0,00","Only accredited partners can render
the service",Supported,2020/07/01,Not stated,Not stated
2020/08/05,South African National Roads Agency,"Freeway Management System,
Advanced Traffic Management System
and Advanced Management Traveller
Information System",IBI Group Professional Services,"149 008 660,00",Sole source,Not Supported,2020/08/05,Not stated,Not stated
2020/06/23,South African Police Service,"Repair of horizontal trim defects SAPS
BRB 240BB,",Absolute Service Centre,1 291 720.48,Sole Source procurement,Noting,2020/06/10,Once Off,Once Off
2020/06/23,South African Police Service,Inspection and change of components,Absolute Service Centre,1 588 927.40,Sole Source procurement,Noting,2020/06/10,Once Off,Once Off
2020/06/23,South African Police Service,"The annual inspection of South African
Police Service aircraft (BPS325B),",Pilatus PC12 Centre Southern Africa,590 761.33,Sole Source procurement,Noting,2020/06/10,Once Off,Once Off
2020/06/23,South African Police Service,"Annual inspection of South African Police
Service aircraft (127414N),",Pilatus PC12 Centre Southern Africa,604 018.96,Sole Source procurement,Noting,2020/06/10,Once Off,Once Off
2020/06/23,South African Police Service,"Supply of new engine monitoring display
on aircraft ZS-RPB and BRR425B,",Airbus Helicopters Southern Africa,1 414 995.32,Sole Source procurement,Noting,2020/06/10,Once Off,Once Off
2020/07/16,South African Police Service,"Reporting: Covid 19 -Procurement of
Examination gloves",Duduza Hospitality,5 300 000.00,Emergency procurement,Noting,2020/7/15,Not Stated,Not Stated
,,,,1 308 212.00,Emergency procurement,,,Not Stated,Not Stated
2020/07/24,South African Police Service,"Procurement of manual and semi-
automated DNA processing system, in
the Eastern Cape Province",Not stated,"263 000 000,00",Limited bidding,Not Supported,2020/7/21,Not Stated,Not Stated
2020/07/09,South African Post Office Limited,"Appeal: Upgrade of Postbank's Banking
System",Oracle - FCUBS,"139 879 567,00",Maintence and Support,Supported,Not Stated,Not stated,Not stated
2020/08/27,South African Post Office Limited,ULA License,Oracle,317 800 149.56,Oracle is the sole provider,Supported,Not Stated,Not stated,Not stated
2020/08/13,South African Revenue Service,Maintenance and support,"Wolters Kluwer Tax and Accounting SA
(Pty) Ltd",35 245 463.35,Sole Provider of Teammate Software,Supported,Not Stated,2020/08/06,2029/03/31
2020/08/03,South African Social Security Agency,"Vodacom airtime vouchers as an
exchange for cash or goods at retail and
merchant stores",Vodacom,0,Service Delivery Urgency,Not Supported,2020/07/29,not stated,not stated
2020/06/29,South African Social Security Agency,"New lease agreement with the current
landlord for SASSA local offices at
Maboloka, Dwarsberg and Ramatlabama",Not Stated,4 172 390.52,Business continuity,Conditional Support,2020/06/22,1/7/2020,2025/06/30
2020/07/15,South African Tourism,"Reporting : Association of Visitor
Experience Association Partnership",African Agenda,"1 410 000,00",Sole Source procurement,Noting,2020/6/24,2020/6/18,2020/3/31
2020/07/15,South African Tourism,"Reporting : WTM 2019 Floor space
Association of Visitor Experinece
Association Partnership",Reeds Exhibitions,"2 007 825,89",Sole Source procurement,Noting,2020/6/24,2019/11/4,2019/11/9
2020/08/12,South African Tourism,HR services,FESCO,"223 200,00",Single Source procurement,Not Supported,2020/8/12,Not Stated,Not Stated
2020/08/16,South African Tourism,"Power-BI Dashboards and Microsoft
Dynamics 365 CRM License fees",Microsoft Ireland,"11 300 576 ,68",Sole Source procurement,Not Supported,2020/8/6,2020/7/12,2023/5/29
2020/08/19,South African Tourism,Oracle HR Suite,Oracle,7 691 726.76,Single Source procurement,Supported,2020/05/13,2020/09/01,2023/08/31
2020/09/09,South African Tourism,"To launch the world Tourism day and the
opening of the Tourism sector",Soulstic music(Black Coffee),2 800 000.00,Single source procurement,Not Supported,2020/8/26,2020/9/27,2021/12/31
2020/07/01,South African Weather Service,"Reporting -Renewal of the UM
Associated Partnership Agreement",UK Meteorological Office (UKMO),"1 718 950,00",Sole Source procurement,Noting,2020/6/30,2020/04/01,2023/03/31
2020/08/25,South African Weather Service,"Three-year service level with IBL Weather
Software Solutions for Global Information
System Centre (GISC) software","IBL Weather Software
Solutions","1 227 100,00",Sole Source procurement,Noting,2020/08/24,Not Stated,Not Stated
2020/08/26,South African Weather Service,"Procurement of numerical weather
prediction output","European Centre for Medium-Range
Weather Forecasts)",5 400 000.00.,Single Source procurement,Supported,2020/8/26,Not Stated,Not Stated
,,,,,546 750 626.54,Emergency Procurement,,,2020/03/08,2020/07/10
,2020/07/08,State Security Agency,"Deviation from normal procurement to
follow a closed bidding process for the
appointment of it service provider to
replicate the existing SAP system and
migrate from IBM to HP",Not Stated,not stated,Closed bid process (Limited market),Conditional Support,2020/05/15,not stated,not stated
,2020/07/09,Statistics South Africa,Sofware Licences,GIS SOFTWARE,"5 485 130,36",GIS Software is the sole provider,Noting,Not Stated,Not Stated,Not Stated
,2020/08/20,Tourism,"Public Works extended programme
infrastructure project",Development Bank of South Africa,Not Stated,Single Source procurement,Conditional Support,2020/8/7,Not Stated,Not Stated
,2020/09/02,Trans-Caledon Tunnel Authority,"Operations and maintenance of the
Western basin Acid Mine Drainage
(AMD) Treatment Plant",Sibanye Stillwater,"430 000 000,00",Sole provider,Within AA/AO mandate Noting,2020/09/02,2020/10/01,2025/09/30
,2020/08/24,Trans-Caledon Tunnel Authority,"Legal professional service provider to
provide legal services to TCTA in respect
of the VRS Project",Various firms,"2 000 000,00",Close bidding process,Conditional Support,2020/08/20,Not stated,Not stated
,2020/07/21,Transnet Limited,Research and development projects,CSIR,"150 000 000,00","Sole Supplier and/or Single Source –
e.g. OEM",Not Supported,2020/07/19,2020/08/01,2023/07/31
,2020/08/03,Transnet Limited,Strategic recruitment,Linkedin,8 782 168.55,Closed bid process (Limited market),Within AA/AO mandate Noting,not stated,not stated,not stated
,2020/07/29,Transnet Limited,The Supply of Refned Fuel,Refiners/Producers/ Original Manufacturers,"2 160 000 000,00","Business Strategy/operations
(Recently found with SOCs with their
turn-around strategies)",Conditional Support,2020/07/29,2020/10/01,2021/07/31
,2020/06/25,Water and Sanitation,Emergency COVID-19 testing,Lancet Laboratories,"2 97 500,00",Emergency,Noting,2020/06/25,Once-Off,Once-Off
,2020/08/24,Water and Sanitation,Legal professional Services,"Moreki Distributors and two service
providers (including Sakhile Ezweni Security
Company)","40 000 000,00","Security services of the water
services infrastructure and
employment of 600 community
workers",Conditional Support,2020/09/02,2020/09/16,2021/03/15
,,,,,,,,,,
,,,,,,,,,,
