,,,,,,,,,,
"GOVERNANCE, MONITORING AND COMPLIANCE: 2019/2020 QUARTER 3 (OCTOBER - DECEMBER 2019) REPORT - EXPANSIONS",,,,,,,,,,
Number,"Entity/Department
(Use dropdown
List)",Project Description,Supplier,Reason for extension,Original Contract Value,Value of Contract Extension,"Value of previous
extensions","not supported/not
supported/Conditional
supported
(Use
dropdown List)","Contract start date
(yyyy/mm/dd)","Contract expiry
(yyyy/mm/dd)"
1,"Agricultural Sector Education and
Training Authority",ICT Services,Solugrowth (Pty) Ltd,Continuity of service,"3 4,125,715.00","3 ,808,898.68","1 8,028,373.00",Supported,2020/04/01,2021/03/31
2,Airports Company South Africa,"Supply, support and maintenance of IT network connectivity, IP telephony
and IT network security service",Sizwe Africa IT Group (Pty) Ltd,Continuity of service,"115,979,772.65","16,889,228.86",0.00,Conditional support,2019/12/01,2020/05/31
3,Airports Company South Africa,"Provision of Passenger Perception Data Collection, Service Excellence
Perception Surveys and Commercial Infrastructure observation",Ratile Research (Pty) Ltd,Continuity of service,"2,999,363.43","494,895.00",0.00,Supported,2019/12/01,2019/12/31
4,Airports Company South Africa,"The supply, maintenance, management and support of IT Workplace
service",Stortech Technology (Pty) Ltd,Continuity of service,"61,273,948.00","17,696,853.23",0.00,Conditional support,2020/03/01,2020/03/30
5,Airports Company South Africa,"Architectural and Design Service for the Office Reconfiguration Project at
Cape Town International Airport",EHH Architects,"Continuity of service and increase in work cost
estimates","4,134,657.72","2,250,190.01",0.00,Not supported,Not Stated,Not Stated
6,Airports Company South Africa,"Transformation services relating to the Office Reconfiguration Project at
Cape Town International Airport",Ramcon CC,"Continuity of service and increase in work cost
estimates","372,120.00","78,582.00",0.00,Not supported,Not Stated,Not Stated
7,Airports Company South Africa,"Project Management Service for Office Reconfiguration Project at Cape
Town International Airport",Ramcon CC,"Continuity of service and increase in work cost
estimates","784,170.00","992,783.33",0.00,Not supported,Not Stated,Not Stated
8,Airports Company South Africa,"Quantity Surveying Services relating to the Office Reconfiguration Project
at Cape Town International Airport",MR QS,"Continuity of service and increase in work cost
estimates","522,741.25","581,866.03",0.00,Not supported,Not Stated,Not Stated
9,Arts and Culture,Commemoration of the legacy of Dr. J.L. Dube,Risimati Consulting (Pty) Ltd,Continuity of service,"25,746,115.96","10,443,437.91",0.00,Supported,Not Stated,Not Stated
10,Art-scape,Catering services,Fedics (Pty) Ltd,Bid process not concluded,0.00,0.00,0.00,Not supported,2019/12/01,2020/03/31
11,Basic Education,Implementation of SAFE Initiative,"National Education Collaboration Trust
(NECT)","Capacity and capability to perform as an
Implementing Agent",0.00,0.00,0.00,Conditional support,Not Stated,Not Stated
12,Brand SA,Provision of legal services,Advisory Fluidrock,Expansion of scope,"1 5,525.00","1 5,525.00",0.00,Supported,Once off,Once off
13,Brand SA,Legal services,MT Silinda and Associates,Variation of order,"5 00,000.00","4 49,915.00",0.00,Supported,2018/11/16,2019/07/17
14,Broadband Infraco SOC,Lease agreement - Swaziland Border,Mahamba Boerdery BK,Continuity of service,"1 31,832.00","1 37,537.47",0.00,Supported,2019/11/01,2024/10/31
15,Broadband Infraco SOC,Lease of piece of Land: 10m x 10m,Stephanus Nel,Continuity of service,"3 1,165.44","1 10,034.34","105,465.89",Supported,2019/11/01,2024/10/31
16,CCMA,Extension of lease agreement - Port Shepstone,The Chambers Property Holding CC,Continuity of service,"4,115,950.00","662,508.88",0.00,Supported,2019/08/01,2020/07/31
17,CCMA,Lease agreement - Tzaneen,Reality 1 Rentals,Continuity of service,"1 29,779.10","2 22,605.28","208,042.32",Supported,2019/12/01,2020/11/30
18,CCMA,Lease agreement of office accomodation- East London,Border Remedies,Continuity of service,"1 1,327,921.81","2 ,216,997.60",0.00,Supported,2020/02/01,2020/12/31
19,CCMA,Lease agreement of office accomodation- Bloemfontein,Michael Family Trust,Continuity of service,"2 3,086,465.31","9 61,675.38","3,830,210.64",Supported,2020/03/01,2020/05/31
20,CCMA,Lease agreement of office accomodation- Ekurhuleni,City Properties,Continuity of service,"2 0,917,007.89","5 ,184,082.20",0.00,Supported,2020/06/01,2021/05/31
22,"Civilian Secretariat for Police
Service",Travel Management Services,Travel With Flair,Continuity of service,"2 3,877,501.00","3 ,000,000.00","7,000,000.00",Supported,2020/01/01,2020/03/31
23,"Construction Industry
Development Board",Facilitation of the joint National Stakeholders Forum,Plus 94 Research,Continuity of service,171 120.00,67 160.00,0,Not supported,2019/09/13,2019/09/13
24,"Construction Industry
Development Board",Appeal:Additional facilitation of the Joint Natonal Skakeholder forum,Plus94 Research,Continuity of service,"171,120.00","67,160.00",0.00,Not supported,Not Stated,Not Stated
25,Council for Geoscience,Provision of canteen services,Nwankumi Development Projects cc,To insource the service,"500,000.00","450,000.00",R 0.00,Not supported,Not stated,Not stated
26,Council for Medical Schemes,Security remedial work on the firewall and VPN configuaration,Information Security Architects (ISA),Urgency procurement method,"3 90,105.81","62,100.00","51,750.00",Supported,Not stated,Not stated
27,"Council for Scientific and Industrial
Research",Access control upgrade,SCW Turnkey,Increase of scope,"7,000,000.00","4,634,038.00",0.00,Supported,Not Stated,Not Stated
28,"Cross Border Road Transport
Agency",Provision of Office Accomodation,Erf 49 Menlyn (Pty) Ltd,Continuity of service,"42,263,086.00","2,062,962.00",0.00,Supported,2020/02/01,2020/03/31
29,DBSA,Professional services,Various service provider,Continuity of service,"7 4,775,077.04","1 3,928,380.87","32,928,380.87",Within AA mandate,2019/10/01,2020/03/31
30,DBSA,Development of single and integrated Revenue Management Framework,Manto Management,Continuity of service,"2 ,567,124.00","4 ,052,004.00",0.00,Supported,2019/11/30,2020/02/27
31,DPSA,Provision of physical security services,Bophani Security Services,Continuity of service,"4 84,800.00","4 84,800.00","4 84,800.00",Not supported,2020/02/01,2020/08/31
32,DPSA,Provision of incapacity leave and ill-health retirement (PILIR),Various service providers,Continuity of service,"2 45,840,567.05","3 08,635,125.62","144,419,001.84",Supported,Date of approval,2 Years
33,EAAB,Legal Services,Mamathuntsha Attorneys,Increases scope of the case,"500,000.00","114,376.48",0.00,Supported,Not stated,Not stated
34,ECIC,Printer and toner services,Bytes documents solutions,Insufficient funds,"878,724.60","5,161.72","131,808.69",Supported,Not stated,2020/01/31
35,Energy,Lease of storage space for 13 427 solar water heater geysers,"Nuclear Energy Corporation of South
Africa",Delays in the bid process,0.00,"128,143.00",0.00,Not supported,Not Stated,Not Stated
36,Environmental Affairs,"Hosting of the 2nd annual National priority area authority summit for quality
management",Manhattan Hotel,Variation of Order,"24,600.00","4,510.00",0.00,Supported,2019/03/19,2019/03/19
37,Environmental Affairs,Stakeholder Consultation session,Protea Hotel,Variation of Order,"23,550.00","4,550.00",0.00,Supported,2019/08/05,2019/08/05
38,Environmental Affairs,"Conference of the parties to the United Nations convention to combat
desertification (UNCCD COP 14)",Protea Hotel Fire & Ice,Variation of Order,"403,140.00","115,392.25",0.00,Supported,2019/08/07,2019/08/09
39,Environmental Affairs,Provision of accounting services,Middel and Partners Incorporated,Variation of Order,"154,917.54","88,578.44",0.00,Not supported,Not Stated,Not Stated
40,Environmental Affairs,Provision of accounting services,Rossal 98,Variation of Order,"199,400.00","62,031.28",0.00,Not supported,Not Stated,Not Stated
41,Environmental Affairs,IPCC review workshop,Protea Hotel,Variation of Order,"12,200.00","5,700.00",0.00,Supported,2019/08/23,2019/08/23
42,Environmental Affairs,Hosting of the legal educationa and awareness training workshop,"Cape Town International Convention
Centre",Variation of Order,"20,530.02","4,771.79",0.00,Supported,2019/11/08,2019/11/08
43,Environmental Affairs,Training workshop on climate change information system,Hotel Osner,Variation of Order,"55,300.00","8,970.00",0.00,Supported,2019/09/04,2019/09/05
44,Environmental Affairs,Hosting of conference venue for the 5D Lekgotla,Peermont Hotel T/A Emperors Palace,Variation of Order,"135,445.00","30,300.00",0.00,Supported,2019/07/08,2019/07/08
45,Environmental Affairs,Training workshop on climate change information system,"Mercure Hotel T/A Premier Lodge
Nelspruit",Variation of Order,"59,400.00","23,232.00",0.00,Supported,Not Stated,Not Stated
46,Environmental Affairs,"To conclude an investigation on the recruitment and selection frame work
of SANBI",Meridian Specialised Skills Institute,Continuity of service,"72,000.00","52,900.00",0.00,Not supported,Not Stated,Not Stated
47,Eskom,"Application and Support of MeterData Repository, TX MDMS and KSACS
Metering Data Management Support",Nextec (Pty) Ltd,Continuity of service,"13,377,733.58","11,913,528.93",0.00,Conditional support,2019/11/01,2020/10/30
Number,"Entity/Department
(Use dropdown
List)",Project Description,Supplier,Reason for extension,Original Contract Value,Value of Contract Extension,"Value of previous
extensions","not supported/not
supported/Conditional
supported
(Use
dropdown List)","Contract start date
(yyyy/mm/dd)","Contract expiry
(yyyy/mm/dd)"
48,Eskom,"Rotor Pole Replacement with New Poles For Units 1 and 2 at Palmiet
Pumped Storage Scheme",Voith-FujiHydro KK,OEM,"62,016,888.04",0.00,0.00,Conditional support,2019/10/31,2021/03/31
49,Eskom,Legal Services for Medupi Borutho Line,Gildenhuys Malatji Inc.,Finalise the appeal process,"1,000,000.00",0.00,0.00,Conditional support,2019/10/17,2021/07/16
50,Eskom,"Supply, transportation, erection and dismantling of scaffolding and
insulation material for generation power stations including Group Capital","Southey Contracting (Pty) Ltd, Kaefer
Thermal Contracting Services, SGB-
Cape and TMS Group Industrial Services
(Pty) Ltd",Continuity of service,"286,200,000.00","1,654,850.00","559,653,718.19",Conditional support,2019/12/01,2021/06/30
51,Eskom,Legal Services for Medupi Borutho Line,Gildenhuys Malatji Inc,Continuity of service,"1,000,000.00",0.00,0.00,Conditional support,2019/10/17,2021/07/16
52,Eskom,Waste Water Treatment at Kusile Power Station,Mott McDonald,Continuity of service,"809,016,356.17","111,597,403.74","226,368,737.60",Conditional support,Not stated,Not stated
53,Eskom,"Construction of Ankerlig –Sterrekus 400kv double circuit overhead
transmission line and its associated works","Mkhulu Electro Distribution Project (Pty)
Ltd","Change of supplier and increased assets
value","173,426,575.90","16,838,213.48","20,319,156.44",Conditional support,Not stated,Not stated
54,Eskom,Coal supply,South32,Ensure Continuity supply,"11,416,000,000.00","1,238,832,900.00","28,080,800.00",Not supported,Not stated,Not stated
55,Eskom,"Supply, Overhaul, Maintenance, Repair, Inspection and Commissioning of
all Maintenance and Outage Actuators",Dhemo Africa (Pty) Ltd,Funds depleted,"21,780,574.64","6,777,293.45",0.00,Conditional support,2019/08/01,2020/07/31
56,Eskom,"Provision of Legal Services in the Arbitration Proceedings with Inyameko
Trading Trading 1577 (Pty) Ltd","Harkoo, Brijal. Reddy and Incorporated",Continuity of service,"990,000.00","750,000.00",0.00,Conditional support,2018/11/01,2021/10/31
57,Eskom,"Conversion and Editing of Portal Document Format (PDF) Software
Subscription",Adobe Ireland Limited,Continuity of service,"2,739,532.89",0.00,"563,299.89",Conditional support,2019/12/01,2020/05/31
58,Eskom,"Support and Maintenance of Eskom Finance Company Core Banking
Systems and Infrastructure",Ernest and Young,Continuity of service,"18,954,495.00","1,833,957.00","33,187,172.94",Conditional support,2019/11/01,2019/01/31
59,ETDP SETA,Extension of ETDP SETA Head Office Lease,Ghandi Square Holdings (Pty) Ltd,Continuity of service,"30,603,538.12","23,071,724.00","7,897,687.26",Supported,2020/07/01,2022/06/30
60,ETDP SETA,Management Information System (MIS),Solugrowth (Pty) Ltd,Continuity of service,0.00,"4 ,768,849.09",0.00,Supported,2020/04/01,2022/03/31
61,Financial Sector Conduct Authority,Provision of Audio-visual solution,AE Soft,Variation of order,"2 ,372,507.50","7 93,442.50",0.00,Supported,Date of approval,2023/11/25
62,FP&M SETA,Head Office Lease in Killarney,"Excellerate Real Estate Services (Pty)
Ltd",Continuity of service,"2,982,264.00","4 ,177,093.81",0.00,Supported,2020/04/01,2022/03/31
63,FP&M SETA,Regional office lease in Durban,Tupac Business Enterprise,Continuity of service,"782,184.00","2 ,305,251.19",0.00,Supported,2020/04/01,2022/03/31
64,FP&M SETA,Regional office lease in Cape Town,HCI-THE Palms (Pty) Ltd,Continuity of service,"1,858,073.09","1,347,831.78",0.00,Supported,2020/04/01,2022/03/31
65,FP&M SETA,Internal audit services,Audit Risk Management Solutions,Continuity of service,"2,000,000.00","2,000,000.00",0.00,Not supported,2020/04/01,2021/03/31
66,FSCA,Provision of disaster recovery and business continuity,Continuity SA,Continuity of service,"6,978,474.90","1,323,175.33","7,961,122.81",Not supported,2019/04/01,2020/03/31
67,FSCA,Provision of disaster recovery and business continuity,Continuity SA,Continuity of service,"6,978,474.90","1,323,175.33","7,961,122.81",Not supported,2019/04/01,2020/03/31
68,Government Printing works,Egazette Support and Maintance- website services,Intervate Solutions (Pty) Ltd,Competitive bid in progress,"5,712,060.00","3,090,783.36","856,736.00",Conditional support,2019/10/01,2019/03/30
69,GTAC,Printing of Annual report,ACM Communications,Continuity of service,"4 5,808.00","1 2,154.85",0.00,Supported,Not stated,Not stated
70,GTAC,"Provision of technical support to the Limpopo Provincial Treasury
Infrastructure Support Programme",Masebo Consulting,Expansion of scope,"3 ,096,000.00","1 ,785,078.76",0.00,Supported,Date of approval,290 days
71,GTAC,"Provision of technical support to the Limpopo Provincial Treasury
Infrastructure Support Programme",Break the Chain Development Services,Expansion of scope,"4 ,074,000.00","2 ,380,096.12",0.00,Supported,Date of approval,290 days
72,Health,Provision of oncology services for the Ethekwini District,Wits Health Consortium,To avoid service disruptions,"12,173,341.01","10,005,486.00","36,686,868.59",Not supported,2019/11/01,2020/04/30
73,Health and Welfare Sector ETA,Office Accommodation,Motif Props/ Aspire / tower property Fund,Continuity of service,"1,188,591","2 97,148.00","1,406,908.00",Supported,2020/04/01,2019/09/30
74,Health and Welfare Sector ETA,Office Accommodation,Broll Property Group (Pty) Ltd,Continuity of service,"1,197,248.00","2 99,310.00","1,082,682.00",Supported,2020/04/01,2019/09/30
75,Health and Welfare Sector ETA,Office Accommodation,Royal Yard Traders,Continuity of service,"869,201.00","2 17,300.00",0.00,Supported,2020/04/01,2019/09/30
76,Health and Welfare Sector ETA,Office Accommodation,Skyline Motors,Continuity of service,"572,959.00","1 72,673.00",0.00,Conditional support,2020/04/01,2019/09/30
77,Health and Welfare Sector ETA,Office Accommodation,JJL Trust,Continuity of service,"636,542.00","159,249.00",0.00,Supported,2020/04/01,2019/09/30
78,Health and Welfare Sector ETA,Office Accommodation,Francois & Louisa Pretorius Family Trust,Continuity of service,"818,892.00","204,723.00","700,351.00",Supported,2020/04/01,2019/09/30
79,Health and Welfare Sector ETA,Office Accommodation,Blue Beacon Investments,Continuity of service,"820,352.00","205,088.00","806,469.00",Supported,2020/04/01,2019/09/30
80,Health and Welfare Sector ETA,Office Accommodation,Blend property,Continuity of service,"562,496.00","140,624.00","571,949.00",Supported,2020/04/01,2019/09/30
81,Health and Welfare Sector ETA,Office Accommodation,Mitis Lex Investments,Continuity of service,"596,584.00","149,146.00",0.00,Supported,2020/04/01,2019/09/30
82,Health and Welfare Sector ETA,Office Accommodation,Blue Crest Property,Continuity of service,"11,143,788.00","2,785,947.00","17,733,810.00",Supported,2020/04/01,2019/09/30
83,Higher Education and Training,Construction of new Nkandla technical college,Rambros Construction CC,Extension of time and escalation shortfall,"194,019,881.00","15,971,560.00","58,932,168.32",Not supported,Not Stated,Not Stated
84,Home Affairs,IT Infrastructure support and maintenance,EOH Mthombo,Non responsive bid,"162,083,334.68","31,094,418.24","104,133,363.24",Conditional support,2019/12/01,2020/05/31
85,Home Affairs,Indirect services within the Gijima Definitive aggreement,"IBM, HP, Accenture, Interfile, Bytes,
EBooth, Infrasol, Optiflex and Edward
Nathan Sonnenbergs.",Out of court settlement,Not stated,"577,782,711.00",0.00,Conditional support,Not stated,Not stated
86,IEC,Lease of office accomodation- East London,Finishing Touch Trading 260,Continuity of service,"1 2,758,842.00","2 0,126,861.00","5,280,776.00",Supported,2020/01/01,2021/12/31
87,IEC,Lease agreement of office accomodation- Centurion,Redefine Properties Limited,Continuity of service,"4 10,069,356.00","1 41,542,881.00",0.00,Supported,2020/09/01,2025/08/31
88,"Justice and Constitutional
Development",Security Infrastructure,Not stated,Quality Review,0.00,0.00,0.00,Conditional support,Not stated,Not stated
89,"Justice and Constitutional
Development",Offsite Estate Records Storage for Selected Offices,Metrofile,Continuity of service,"15,053,405.85","3,203,153.17",0.00,Conditional support,2019/10/01,2020/03/20
90,Labour - UIF,Provision of accounts verification services,ABSA Bank,Expansion of scope,"2 ,152,955.70","3 ,600,000.00",0.00,Not supported,2019/10/01,2020/06/30
91,Legal Aid,Pretoria Local Office space,Chainprops (Pty) Ltd,Competitive bid in progress,"199,617.06","591,192.00",0.00,Conditional support,Not stated,Not stated
92,Legal Aid,Group Assurance Services,Wynsam Wealth,Competitive bid in progress,"3,111,050.88","548,575.60",0.00,Conditional support,2019/01/11,2019/12/31
93,Legal Aid,Group Life Assurance,Wynsam Wealth,Competitive bid in progress,"3,111,050.88","548,575.60",0.00,Supported,2019/11/01,2019/12/01
94,Legal Aid SA,Variation due verification process taking long,Beescore,Continuity of services,"60,233.80","11,500.00",0.00,Not supported,Not stated,Not stated
95,Lepelle Northern Water,Provision of telecommunication services,Telkom SA,Continuity of service,"5,803,791.56","405,744.00","780,123.05",Conditional support,2019/12/01,2020/02/28
96,Lepelle Northern Water,Physical security services,CS Security,Continuity of service,"11,365,059.30","1,271,867.51","1,138,778.82",Conditional support,2019/12/01,2020/02/31
97,Local Gov SETA,Office Accommodation,Growth Point Management Services,Continuity of service,"3,406,415.00","3 ,121,116.00","1,320,000.00",Conditional support,2020/04/01,2025/03/31
Number,"Entity/Department
(Use dropdown
List)",Project Description,Supplier,Reason for extension,Original Contract Value,Value of Contract Extension,"Value of previous
extensions","not supported/not
supported/Conditional
supported
(Use
dropdown List)","Contract start date
(yyyy/mm/dd)","Contract expiry
(yyyy/mm/dd)"
98,Local Gov SETA,Office Accommodation,Delta Property Fund,Continuity of service,"1 ,999,455.75","2 ,200,000.00","1,583,605.75",Conditional support,2020/04/01,2023/03/31
99,Local Gov SETA,Office Accommodation,Rock properties Trust,Continuity of service,"1 ,535,999.75","7 76,524.40","2,312,524.15",Conditional support,2020/04/01,2021/03/31
100,Local Gov SETA,Office Accommodation,Redefine Properties,Continuity of service,"407,546.23","8 00,000.00","426,581.70",Conditional support,2020/04/01,2023/03/31
101,Local Gov SETA,Office Accommodation,Thomas Family Trust,Continuity of service,"1,188,382.64","7 00,000.00","1,150,480.00",Conditional support,2020/04/01,2021/03/31
102,Local Gov SETA,Office Accommodation,"Public Investments Corporation -
Mowana Properties",Continuity of service,"15,317,700.18","5 ,615,805.00","5,615,805.00",Conditional support,2020/04/01,2021/03/31
103,Local Gov SETA,Office Accommodation,Delta Property Fund (Pty) Ltd,Continuity of service,"730,957.96","1 ,500,000.99","954,581.00",Conditional support,2020/04/01,2023/03/31
104,Local Gov SETA,Office Accommodation,Columbia Falls - Maponya Investment,Continuity of service,"1,168,590.78","1 ,437,156.00","1,437,156.00",Conditional support,2020/04/01,2021/03/31
105,Local Gov SETA,Office Accommodation,"Excellerate Real Estate Services (Pty)
Ltd",Continuity of service,"8 45,424.00","1,700,000.00",0.00,Conditional support,2020/04/01,2023/03/31
106,Local Gov SETA,Network Infrastructure,Vox Telecomms,Continuity of service,"1 ,849,879.22","1 ,579,735.50","4,079,400.00",Conditional support,2020/04/01,2021/03/31
107,Local Gov SETA,Management Information System,RemoteNet,Continuity of service,"6 ,134,822.36","4 ,633,560.00","6,097,235.76",Conditional support,2020/04/01,2022/03/31
108,Local Gov SETA,Training of stakeholders,Panel of accredited service providers,Continuity of service,0.00,0.00,0.00,"Within AA/AO mandate
Noting",2020/04/01,2021/03/31
109,Mango Flight,Ground Handling services,Bid Air services,Competitive bid in progress,0.00,"70,000,000.00","40,000,000.00",Conditional support,2019/11/01,2019/03/31
110,"Manufacturing, Engineering and
Relate for Q1d SETA",Internal Audit services,OMA Chartered Accountants,Continuity of service,"1 ,167,217.66","7 95,809.35","175,082.65",Not supported,Not Stated,Not Stated
111,MDDA,Lease agreement of office accomodation - Parktown,Growth Point,Continuity of service,"5 ,842,930.00","6 ,669,630.00",0.00,Supported,2020/03/01,2025/02/28
112,"Media, Information and
Communication Technologies
SETA",Provision of office accomodation,Euphoria (Pty) Ltd,Continuity of service,"11,745,678.29","908,480.65","8,798,929.24",Conditional Support,2019/10/01,2019/12/31
113,"Municipal Infrastructure Support
Agent (MISA)",Mentoring Services for Young Graduates,The Renaissance Network,Addiitonal graduates,"6,528,313.00","5,802,944.00",N/A,Conditional support,36 months,2021/04/24
114,National Credit Regulator,Legal Services,Mamokgalake Chuene Attorneys,Insufficient funds,"400,000.00","1,000,000.00","60,000.00",Conditional support,Not stated,Not stated
115,National Credit Regulator,Legal Services,VZLR Attorneys,Cost effective,0.00,"1,000,000.00",0.00,Conditional support,Not stated,Not stated
116,National School of Governement,Upgrade of Internet Bandwidth,SITA,Continuity of service,"1,170,964.37","2,327,846.19",0.00,Supported,2019/11/01,2023/03/31
117,National Treasury,Provision of additional supply of hand and paper towels,Nesoscope Holdings,Expansion of scope,"2 1,087,004.00","6 68,530.40",0.00,Within AA mandate,Date of approval,2021/11/30
118,National Treasury,Provision of IFMS Organisational Change Management,APEX Advisory Services,Continuity of service,"3 4,904,573.33","1 7,423,271.56",0.00,Supported,2019/11/13,2020/05/12
119,National Treasury,Recruitment services,Amargi Media,Continuity of service,"4 2,500.00","5 1,000.00",0.00,Supported,Not stated,Not stated
120,National Treasury,Rendering of Primary Health Care services,Momentum OCSA,Expansion of scope,"10,922.60 (per month)","18,408.08 (per month)",0.00,Supported,Not stated,Not stated
121,National Treasury,Online newspaper subscription and newspaper distribution,Calandria 159 t/a Newspaper Direct SA,Continuity of service,"2 82,445.00","312,900.00",0.00,Supported,2020/02/13,2021/10/12
122,National Treasury,Renewal of EconoStat,IHS INFORMATION & INSIGHTS,Sole supplier,"1 99,237.50","6 59,410.00",0.00,Within AA mandate,2020/02/01,2023/01/31
123,National Treasury,Renewal of the Easy Data Contract,Quantec,Sole supplier,"1 46,273.10","5 05,089.20",0.00,Within AA mandate,2020/02/01,2023/01/31
124,National Treasury,Professional Service SLA,Dimension Data,Expansion of scope,"1 5,918,000.00","2 8,341,016.99",0.00,Not supported,Not stated,Not stated
125,NDA,Provision of Office Accomodation,Bleand Prpertirs,Continuity of services,Not stated,0.00,0.00,Conditional support,2019/12/01,Not stated
126,NEMISA,Provision of temporary company secretarial services,Fluidrock Advisory,Continuity of service,"3 75,000.00","4 50,000.00",0.00,Supported,2020/01/01,2020/04/30
127,NHBRC,Short tern Insurance and Claims Management,Sankofa,"Change of supplier and increased assets
value","3,365,829.00","830,343.63",15/11/2019,Not supported,Not stated,Not stated
128,NTP Radioisotopes SOC Ltd,Appeal: Renovations and upgrades at C4 building,Microzone Projects,"Additional work was determined after opening
up plastered ceilings and trenches.","6,355,484.27","2,229,835.23","1,219,618.26",Supported,Not stated,Not stated
129,"Perishable Products Export
Control Board",ICT infrastructure services,Dimension Data,Negotiation with preferred bidder,"1,566,844.00","450,000.00","R 35,291.00",Not supported,Not stated,Not stated
130,PetroSA,Provision of maintenance and operation of aircrafts,Indwe Aviation (Pty) Ltd,PetroSA will save R51 million,"868,426,837.00","222,130,314.00",R 0.00,Supported,2020/03/01,2022/02/28
131,PetroSA,"Provision of high pressure water jetting, industrial vacuum cleaning,
catalyst handling and chemical cleaning services",Averda South Africa,Finalising a tender process,"18,143,091.75","3,515,652.00","20,581,069.31",Withdrawn,2019/10/01,2019/12/31
132,Public Works,Provision of performance based intergrated facilities management,Broll Property Group (Pty) Ltd,Continuity of service,"456,929,655.58","83,132,342.00",0.00,Supported,2019/10/01,2020/09/30
