,Department/ Entity,Project Description,Supplier,Reason for extension,Original Contract Value,Value of Contract Extension,Value of previous extensions,"Award/
Recommended
date by AO/AA","Supported/Not
Supported","Contract Start
Date","Contract End
Date"
1,ACSA,"Friction testing on runways at all
Airports",SRT,The number of tests estimated increase,"4 240 686,00","2 528 888,00","0,00",Not dated,Supported,2017/01/01,2017/03/30
2,ACSA,Friction Testing for airfield grounds,ADB Airfield Solution,Expansion of scope of work,"4 708 478,43","2 631 547,48","0,00",2017/01/30,Supported,Not stated,2017/07/31
3,ACSA,"Application of property rights &
finalisation ACSA park township","African Development Planning
Company",Expansion of scope of work,"2 180 000,00","7 40 000,00","0,00",2017/02/07,Supported,Not stated,Not stated
4,AEMFC,"Storage of employees medical
surveillance records",Clinic Plus Occupational Service,Increase in number of employees.,"156 152,00","810 540,00","0,00",2017/02/02,Conditional support,2017/04/01,2020/03/31
6,AEMFC,"Provision of minining service at
Vlakfontein mine",Concor Opencast Mining,Finalise transition process.,"252 000 000,00","33 000 000,00","444 000 000,00",2017/02/22,Conditional support,2017/04/01,2017/05/31
7,Arts and Culture,Services of a sculptor,Ernst & Young,Additional scope,"369 158,40","490 809,08","0,00",2017/01/17,Not Supported,Once off,Once off
8,Basic Education,"ASIDI School building programme -
Lubala PS in the Eastern Cape","Development Bank of Southern
Africa (DBSA)",Omission in the BOQ and change of scope.,"15 400 495,18","6 405 928,50","0,00",2017/02/01,Conditional support,Not stated,Not stated
9,Basic Education,"ASIDI School building programme -
Nobantu PS in the Eastern Cape","Development Bank of Southern
Africa (DBSA)",Replacement of contractors,"13 799 778,56","25 750 453,43","0,00",2017/02/01,Not Supported,Not stated,Not stated
10,Basic Education,"ASIDI School building programme -
Qaka PS in the Eastern Cape","Development Bank of Southern
Africa (DBSA)",Replacement of contractors,"11 497 390,17","27 994 662,64","0,00",2017/02/01,Not Supported,Not stated,Not stated
11,Basic Education,"ASIDI School building programme -
Ntsonyini PS in the Eastern Cape","Development Bank of Southern
Africa (DBSA)",Replacement of contractors,"4 446 071,44","15 071 635,54","0,00",2017/02/01,Not Supported,Not stated,Not stated
12,Basic Education,"ASIDI School building programme -
Ngidini PS in the Eastern Cape","Development Bank of Southern
Africa (DBSA)",Replacement of contractors,"11 497 390,17","3 400 067,88","0,00",2017/02/01,Not Supported,Not stated,Not stated
13,Basic Education,"ASIDI School building programme -
Ndluzula JP in the Eastern Cape","Development Bank of Southern
Africa (DBSA)",Replacement of contractors,"11 497 390,17","4 986 525,22","0,00",2017/02/01,Not Supported,Not stated,Not stated
14,Basic Education,"ASIDI School building programme -
Nomandla PS in the Eastern Cape","Development Bank of Southern
Africa (DBSA)",Replacement of contractors,"11 497 390,17","6 532 049,56","0,00",2017/02/01,Not Supported,Not stated,Not stated
15,Basic Education,"ASIDI School building programme -
Gcinisizwe PS in the Eastern Cape","Development Bank of Southern
Africa (DBSA)",Replacement of contractors,"11 497 390,17","4 534 741,19","0,00",2017/02/01,Not Supported,Not stated,Not stated
16,CBE,Travel Services,Nexus Travel,Continuity of service,"1 800 000,00","250 000,00","604 000,00",2017/03/06,Conditional support,2017/04/01,2017/05/31
17,CCMA,Travel Management Services,Travel with Flair,Competitive bidding process in progress,"2 735 071,09","679 561,60","679 561,60",2017/03/22,Conditional support,2017/04/01,2017/09/30
18,CETA,Fleet servicing,Toyota and Nissan,Fleet out of warranty,Not Stated,"4 937 002,18","0,00",2017/09/02,Conditional support,2017/01/03,2020/01/04
19,CETA,Panel of car rentals,"Capital Car Hire, Sizwe Car
Rental and Europcar",Competitive bidding process in progress,"4 719 574,32","64 829,93","0,00",2017/03/30,Conditional support,2017/01/04,2017/04/30
20,CIDB,"Microsoft Software Development,
maintenance and support on the CRM
system",nVision IT (Pty) Ltd,Competitive bidding process in progress,"6 566 400,00",1 200 000.00,"0,00",2017/02/13,Conditional support,2017/01/01,2017/12/31
21,COGTA,Extension of the current NPO contracts,Various NPOs,Procurement process has not yet commenced,Not stated,Not stated,Not stated,2017/01/30,Not Supported,2017/04/01,2017/09/30
22,CSIR,Provision of the security services,"Bidvest Protea Coin Group (Pty)
Ltd",Competitive bidding process in progress,"26 500 000,00","6 500 000,00","19 900 000,00",2017/03/03,Supported,2016/04/01,2017/09/30
23,CSIR,Landscaping and gardening services,Servest Landscaping (Pty) Ltd,Competitive bidding process in progress,"5 561 697,00","1 202 156,00","0,00",2016/11/23,Supported,2017/12/01,2017/05/31
24,CSIR,Travel management services,Carlson Wagonlit Travel,"Travel Policy Framework not published yet by
National Treasury","25 970 624,00","4 274 748,00","0,00",2017/03/13,Supported,2017/04/01,2018/03/31
25,DBSA,SAP support system (FILO),Delloitte,Competitive bidding process in progress,"7 236 000,00","402 000,00","1 206 000,00",2017/03/14,Supported,2017/04/01,2017/05/31
26,DBSA,SAP support system (HCM),Gijima,Competitive bidding process in progress,"3 265 200,00","181 400,00","544 200,00",2017/03/14,Supported,2017/04/01,2017/05/31
27,DBSA,SAP support system (CML),Ernst and Young,Competitive bidding process in progress,"4 057 600,00","338 133,34","676 266,67",2017/03/14,Supported,2017/04/01,2017/05/31
28,DIRCO,Travel Contract,Wing Naledi Travel,Competitive bidding process in progress,"1 319 525,00","189 042,00","0,00",2017/02/24,Supported,2017/04/01,2017/06/30
29,DIRCO,Travel Contract,Magic Travel,Competitive bidding process in progress,"1 512 338,00","173 940,00","0,00",2017/02/24,Supported,2017/04/01,2017/06/30
30,DPE,"Re-developing and maintaing DPE’S
website to include re-developing,
hosting and maintaining",N-Vision,Expansion of scope,969 287.85,"633 399,17","0,00",2017/02/14,Noting,Not stated,01/04/2017
31,DPE,"Support Ministry and the department
with strategic communication","The Oryx Multimedia Group
(Pty) Ltd",Competitive bidding process in progress,"4 95 900,00","500 000,00","0,00",2017/02/24,Conditional support,2017/05/01,3 months
32,DST,"Repairs of the airdale units and
replacement of the speed drives",Centrotech,Impractical to follow normal SCM process,"179 262,72","66 262,67","0,00",2016/12/04,Conditional support,2015/08/01,2017/07/31
33,DWS,"Support and maintain the National
Integrated Water Information System",DHI South Africa (Pty) Ltd,Competitive bidding process in progress,"4 374 454,00",642 504.00,"642 522,00",2017/03/17,Conditional support,2017/03/01,2017/08/31
34,DWS,"Provision of security services (Western
Cape)",Venus Security Solutions,Competitive bidding process in progress,"10 490 194,00",6 070 924,"0,00",2017/03/17,Conditional support,2016/04/01,2017/07/31
35,DWS,"Provision of security services
(Mpumalanga)",Sidas Security Guards (Pty) Ltd,Competitive bidding process in progress,"12 045 059,00","6 970 762,00","675 048,00",2017/03/17,Conditional support,2016/04/01,2017/07/31
36,DWS,"Provision of security services (Northern
Cape)","Raite Security Services and
Consulting",Competitive bidding process in progress,"12 105 508,00","7 005 745,00","0,00",2017/03/17,Conditional support,2016/04/01,2017/07/31
37,DWS,"Provision of security services (40
Limpopo sites)",Phiriphiri Security Services,Competitive bidding process in progress,"19 926 523,00","11 519 552,00","0,00",2017/03/17,Conditional support,2016/04/01,2017/07/31
38,DWS,"Provision of security services (3
Limpopo sites)","Mushoma Security Services
(Pty) Ltd",Competitive bidding process in progress,"17 939 479,00","10 382 002,00","0,00",2017/03/17,Conditional support,2016/04/01,2017/07/31
39,DWS,"Provision of security services (12
Limpopo sites)",MCC Security and Projects CC,Competitive bidding process in progress,"19 630 066,00","11 360 385,00","0,00",2017/03/17,Conditional support,2016/04/01,2017/07/31
40,DWS,"Provision of security services
(Gauteng)",Mafoko Security Patrols (Pty) Ltd,Competitive bidding process in progress,"23 322 457,00","13 497 260,00","0,00",2017/03/17,Conditional support,2016/04/01,2017/07/31
41,DWS,"Provision of security services (19
Limpopo Sites)",Khayalami Security CC,Competitive bidding process in progress,"18 832 883,00","10 899 037,00","1 578 672,00",2017/03/17,Conditional support,2016/04/01,2017/07/31
42,DWS,"Provision of security services (KwaZulu-
Natal)","Ditiro Tsaka Trading and
Projects Ltd",Competitive bidding process in progress,"6 663 013,00","3 856 044,00","0,00",2017/03/17,Conditional support,2016/04/01,2017/07/31
43,DWS,"Provision of security services (Free
State)","Ditiro Tsaka Trading and
Projects Ltd",Competitive bidding process in progress,"2 604 422,00","1 507 241,00","0,00",2017/03/17,Conditional support,2016/04/01,2017/07/31
44,DWS,"Provision of security services (Eastern
Cape)","Dikha Security and Cleaning
Service (Pty) Ltd",Competitive bidding process in progress,"22 567 072,00","13 060 101,00","0,00",2017/03/17,Conditional support,2016/04/01,2017/07/31
45,DWS,"Provision of security services (North
West)","Batlhokomedi Management
Service (Pty) Ltd",Competitive bidding process in progress,"20 804 760,00","12 040 209,00","0,00",2017/03/17,Conditional support,2016/04/01,2017/07/31
46,Environmental Affairs,"Interpretation services for side event
between South Africa and Mozambique",Congress Rentals,Continuity of service,"37 739,70",29 519.13,"0,00",2016/12/04,Supported,2016/10/03,2016/10/03
47,Environmental Affairs,"Implementation of various NRM
programmes",Various implementing agencies,Continuity of service,"1 904 963 782,00",628 638 048.00,"0,00",2017/01/18,Conditional support,2017/04/01,2018/03/31
48,Environmental Affairs,"Transcription of audio recordings
services","Omolemo and Moayi Trading
and Pro",Continuity of service,"23 000,00","7 500,00","0,00",2017/01/25,Supported,2017/02/01,2017/03/01
49,Environmental Affairs,Conference Facilities,Protea Hotel,Participants increased from 80 to 105.,"30 750,00","9 150,00","0,00",2017/01/31,Supported,2016/09/28,2016/09/28
50,Environmental Affairs,"Special Needs and Skills Development
programme",CSIR,Continuity of service,"7 258 608,00","3 394 920,00","0,00",2017/02/09,Not Supported,2017/02/07,2018/07/31
51,Environmental Affairs,Travel Services,Travel with Flair,Continuity of service,1 500 00.00,"225 000,00","0,00",2017/02/27,Conditional support,2017/03/04,2017/06/03
52,Eskom,"Provision of SAS software &
professional services",SAS Institute (Pty) Ltd,Increase data volumes,"29 186 756,76","231 730 314,10","87 160 490,68",2017/01/13,Supported,2017/07/07,2018/07/07
53,Eskom,"Provision of recruitment services to
Majuba Rail Project",Backhousia Consulting CC,Alignment of contract with approved ERA's,"38 109 767,56","4 9 117 788,49","7 99 256,14",2017/01/17,Supported,2017/02/16,2018/12/31
54,Eskom,"Provision of field & quality engineering
services","Arup Tata Power Engineering
Consortium",Continuity of service,"104 795 567,04","47 216 387,76","1 1 400 000,00",2017/01/30,Supported,2017/02/28,2018/03/31
55,Eskom,"Procurement of Teleprotection
equipment",ABB SA (Pty) Ltd,Expansion of scope of work,"2 505 738,88","9 043 952,00","4 125 470,80",2017/01/30,Supported,2017/02/28,2018/03/31
56,Eskom,"Manufacturing, testing, supply &
delivery of various pole mounted","ADC Energy CC & E-Lek
Engineering (Pty) Ltd",Single Source,"0,00","0,00","0,00",2017/02/08,Supported,2017/06/09,2019/06/08
57,Eskom,"Design, manufacture, testing & supply
of line hardware for distribution and
transmission","Babcock Ntuthuko Powerlines
(Pty) Ltd",Expansion of scope of work,"312 696 143,48","209 599 098,22","0,00",2017/02/22,Not Supported,Not stated,Not stated
58,Eskom,"Fencing (Western Cape Operating
Unit)","Gordian Fence SA (Pty) Ltd and
Afriwire",Expansion of scope of work,"33 333 333,32","2 1 425 746,00","1 6 614 057,00",Not dated,Conditional support,Not stated,Not stated
59,Eskom,"Uninterupted Power Supplies (UPS)
(P16) at Medupi Power Station",Standby Systems,Continuity of service,"132 037 510,00","10 573 334,79","0,00",2016/12/14,Conditional support,2016/12/31,2019/06/30
60,Eskom,"Transmission of Power Delivery
Projects",Consolidated Projects (Pty) Ltd,Expansion of scope of work,"158 259 330,15","44 292 964,84","202 552 294,44",2017/01/09,Conditional support,Not stated,Not stated
61,Eskom,"Provision of software license,
maintenance and support and
professional services",Micro Focus Software Ireland,Sole source,"73 500 000,00",140 441 334.50,"233 650 610,20",2017/01/13,Supported,Not stated,Not stated
62,Eskom,"Cleaning outside at Matimba Power
Station",Mmakgoge (Pty) Ltd,Enable legal investigations to take place,"20 464 946,00","9 181 896,00","14 265 294,00",2017/01/17,Conditional support,2017/02/01,2017/12/31
63,Eskom,"Psychometric assessment materials
and services",JVR Psychometrics,Insufficient budget,"600 000,00","800 000,00","0,00",2017/01/17,Conditional support,2016/06/01,2017/05/31
64,Eskom,"Electrification of Households, Schools
and Clinicis in Limpopo",Panel of 88 contractors,Backlog of electrification,"127 263 217,20","127 724 587,85","93 292 953,60",23/01/2017,Conditional support,2017/06/15,2017/03/31
65,Eskom,"Provision of meetings management
services for Eskom Board","iThemba Governance and
Statutory Solutions (Pty) Ltd",Retain the level of proficiency,"1 218 000,00","2 030 000,00","0,00",26/01/2017,Conditional support,2017/02/01,2017/12/31
66,Eskom,"Construction supervision phase 4 at
the Ingula pumped storage scheme","Braamhoek Consultants Joint
Venture (BCJV)",Expansion of scope of work,"0,00","589 621 050,73","0,00",2017/02/08,Conditional support,2017/04/11,2018/04/10
67,Eskom,"Manufacture, testing, supply, delivery,
off-loading, erection and
commissioning of 400kV","Actom High Voltage Equipment,
a division of Actom (Pty) Ltd",Competitive bidding process in progress,"95 388 050,00","54 698 715,00","150 086 765,00",2017/02/09,Conditional support,Not stated,12 months
68,Eskom,"Provision of coal sampling; oversight
and analysis of Eskom coal imports","MBMCF Resource Management,
Mpumamanzi Group, Natural
Sampling Services, Noko
Analytical Services, Rockom
Transport and Projects, SABS
Commercial SOC Ltd, SGS
South Africa (Pty) Ltd and Siza
Coal Services).",Competitive bidding process in progress,"193 500 000,00","36 000 000,00","0,00",2017/02/21,Conditional support,2017/04/01,2017/09/30
69,Eskom,"Accommodation of 159 Hitachi Artisans
for Kusile Power Station project.",Villa Roma Boutique Hotel,Expansion of scope of work,"8 174 250,00","7 263 900,00","2 478 600,00",2017/042/24,Conditional support,2017/03/01,2017/08/31
70,Eskom,"Supply of 1.2 million tons of coal from
the Klipfontein Colliery",Iyanga Mining (Pty) Ltd,Competitive bidding process in progress,"506 018 266,67","720 298 528,00","321 558 518,67",Not stated,Conditional support,2017/03/01,2017/08/31
71,Eskom,"Provision of construction management
staff to support Kusile Power Station",Impulse International (Pty) Ltd,Continuity of service,"76 734 640,00","119 081 920,00","3 094 599,98",2017/03/17,Not Supported,2017/03/20,2018/01/19
72,Eskom,"Provision of project controls reporting
for generation, new build and
renewables projects","Arup Tata Power Engineering
Consortium",Continuity of service,"25 500 933,60","73 749 381,03","36 075 084,54",2017/01/30,Conditional support,2017/02/28,2018/03/31
73,Eskom,"Provision of permanent security
services for the Western Cape
Operating Unit.","Greystone Trading 389 CC and
Eden Security Services CC",Competitive bidding process in progress,8 500 000.00,"1 366 854,05","13 835 146,68",Not stated,Conditional support,Not stated,Not stated
74,Eskom,"Electrification of household’s
connections, infrastructure and infills.",Various suppliers,Expansion of scope of work,"300 000 000,00","84 472 653,00","0,00",Not stated,Conditional support,2016/01/01,2017/01/30
75,Eskom,"Refurbishment of outside plant, water
treatment control and instrumentation
at Tutuka Power Station.",Yokogawa South Africa (Pty) Ltd,Expansion of scope of work,"139 696 225,58","51 961 221,21","143 662 637,00",Not stated,Conditional support,2017/11/01,2018/02/28
76,Eskom,"Engineering, Design, Manufacture,
Inspection, Delivery, Site testing,
Commissioning of 24 complete
Auxillary oil Transformers; associated
fire protection system and earthing
resistors for the Kusile Power Station",Zest Electric Motors (PTY) Ltd,Delays caused by other contractors,"82 029 507,31","13 611 034,12","0,00",Not stated,Conditional support,Not stated,40 months
77,Eskom,Industrial and medical gases,"Afrox (Pty) Ltd and Air Products
(Pty) Ltd",Competitive bidding process in progress,"20 000 000,00",18 735 639.67,"22 168 302,41",2016/12/20,Conditional support,Not stated,6 months
78,Eskom,"Project controls, reporting for
generation, new build and renewables
projects","Arup Tata Engineering
Consortium",Continuity of service,"25 500 933,60","36 075 084,54","37 674 296,49",Not stated,Conditional support,2017/02/28,2018/03/31
79,Eskom,"Manufacture, testing, delivery, off
loading and erection of estimated
quantities 11-120kv transformers.","Instrument Transformer
Technologies",Competitive bidding process in progress,"33 676 568,34","0,00","0,00",Not stated,Conditional support,2016/11/01,2017/02/28
80,Eskom,"Low Voltage Switchgear Kusile Power
Station",Siemens SA,Delays caused by other contractors,491 163 194.44,"0,00","0,00",2017/01/30,Conditional support,Not stated,36 Months
81,Eskom,"Design, manufacture, testing and
supply of medium voltage electric
motors to various power stations","ABB South Africa; Actom (Pty)
Ltd; Zest Electric Motors (Pty)
Ltd","Allow for the outstanding orders and additional
items to be delivered","244 082 414,46","284 952 360,00","284 952 360,00",Not stated,Supported,2017/05/01,2017/08/31
82,Eskom,Purchase of vehicles ancilaries,Various suppliers,"Alignment of contract with approved capital
budget","159 341 338,00","129 924 911,00","0,00",Not stated,Conditional support,Not stated,Not stated
84,Eskom,Supply coal to Kusile power station,Universal Coal,Improve coal specification.,"3 154 983 000,00","5 101 861 679,00","616 675 054,00",2017/03/20,Not Supported,2013/04/01,2023/03/31
86,Eskom,"Construction of burner facility in
CAMDEN Power station",Tsalanang Pty LTD,Extension of contract period,"3 227 375,00","0,00","0,00",2017/03/15,Conditional support,2016/10/17,2017/10/17
87,Eskom,Construction of Gromis in Orenjemond,OPTIPOWER Projects,Expansion of scope of work,"178 197 922,00","40 398 000,00","0,00",2017/04/21,Conditional support,2016/01/15,2017/08/14
88,Eskom,"Provision of security services for all
units and National Key Points",25 Contracts,"Cancellation of tender due to non responsive
bids received","397 575 048,00","411 400 136,00","926 839 134,00",2017/02/15,Conditional support,2017/04/30,2018/03/01
89,Eskom,"Supply Sulphur to various Power
Stations",Sasol Nitro,Competitive bidding process in progress,"115 720 000,00","12 654 658,00","31 179 056,00",2017/03/23,Conditional support,2010/12/01,2017/09/30
90,Eskom,Construction of overhead lines,Various service providers,Insufficient budget,"98 396 347,00","9 146 692,00","0,00",2016/12/14,Conditional support,Not stated,Not stated
91,Eskom,"Provision of Server Support Services,
Disaster Recovery Data Centre
Services, End-User Computing
Services and Service Desk Support",T-Systems,Competitive bidding process in progress,"2 936 231 859,00","942 344 318,00","3 388 581 250,00",2017/02/08,Conditional support,2017/03/01,2018/04/30
92,Eskom,Provision of security services,"Eden Security CC and Raite
Security",Competitive bidding process in progress,"18 000 000,00","4 405 774,36","6 7 249 648,41",Not dated,Conditional support,Not stated,Not stated
93,Eskom,"Transportation of coal from various rail
sidings to Tutuka, Grootvlei, Camden
and Majuba Power Stations",Transnet Freight Rail (TFR),"Impractical to negotiate new contracts for a
longer period without a long term view of the
coal requirements for the power stations","4 857 766 000,00","2 055 472 844,00","0,00",2017/02/24,Conditional support,2017/04/01,2017/10/31
94,ETDP SETA,Software Licence and payroll services,SAGE VIP,Single Source,"148 304,88","148 304,88","0,00",2017/02/24,Conditional support,2017/01/03,2018/01/04
95,ETDP SETA,Storage facility,Kwamasiza Transport,Limited/No space on the new premises,"467 217,60","141 930,00","0,00",2017-0223,Conditional support,2017/01/04,2017/08/31
96,ETDP SETA,Provision of Office Space,Global Continuity SA (Pty) Ltd,Non-responsive bids,"1 275 063,60","1 311 000,00","786 000,00",2016/10/03,Conditional support,2017/01/04,2017/08/31
97,FIC,"Supply of Newspapers and Financial
Magazines",Sephoti Trading & Projects,Continuity of service,"122 226,64","91 018,56","0,00",2017/01/12,Supported,2017/02/01,2018/02/28
98,FIC,"Supply of Newspapers and Financial
Magazines",Cape Subscriptions Cc,Continuity of service,"9 921,60","10 464,00","0,00",2017/01/12,Supported,2017/02/01,2018/02/28
99,FIC,"Supply of Newspapers and Financial
Magazines",Cape Subscriptions Cc,Continuity of service,"11 606,39","15 412,80","0,00",2017/01/12,Supported,2017/02/01,2018/02/28
100,FIC,"Premium paid subscription of various
applications",Various Service Providers,Continuity of service,"8 744 352,91","5 818 442,27","0,00",2017/03/23,Conditional support,2017/04/01,2020/03/31
101,GTAC,Communication services,Lathithaa Consulting Services,Expansion of contract period,"729 600,00","1 500 000,00","1 09 000,00",2017/01/20,Supported,2017/02/01,2017/07/31
102,GTAC,"Municipal Finance Improvement
Programme",Various Service Providers,Competitive bidding process in progress,"12 551 446,00","1 473 100,00","0,00",2017/03/31,Not Supported,2017/04/01,2017/05/31
103,Health,Storage of confidential documents,Metrofile (Pty) Ltd,Confidentiality on medical files,"282 722,00","166 456,00","73 721,00",2017/03/02,Conditional support,2017/04/01,2018/03/31
104,Health,"Replacement of clinics and Community
Health Centres",Procurement Dynamics,Expansion of scope due to Operation Phakisa,"5.72% per clinic; 4.50% per CHC
and 5.50% disbursement fees
per facility","9,90%","0,00",2017/03/08,Conditional support,2014/11/07,2017/11/06
105,Health,"Provide preventative and clinical
services on a seasonal basis in public
health facilities","Foundation for Professional
Development (Pty) Ltd",Competitive bidding process in progress,"26 606 218,00","3 616 766,00","3 146 769,00",2017/03/27,Conditional support,2017/04/01,2017/09/30
106,Health,"Extension of private physical security
contract",Dem Security Services CC,Competitive bidding process in progress,"441 600,00","73 600,00","0,00",2017/03/29,Conditional support,2017/04/01,2017/05/31
107,Health,"Extension of private physical security
contract",Raite Security Services CC,Competitive bidding process in progress,"465 120,00","77 520,00","0,00",2017/03/29,Conditional support,2017/04/01,2017/05/31
108,Health,"Extension of private physical security
contract",Motsodi Trading Enterprise CC,Competitive bidding process in progress,"447 173,00","74 528,00","0,00",2017/03/29,Conditional support,2017/04/01,2017/05/31
109,ICASA,"Bandwith and Video conferencing
bridging solutions",Galeboe Professional Service,Uninterupted access to internet,"2 628 847,57","1 344 215,22","0,00",2016/12/14,Supported,2016/07/07,Once-Off
110,"Justice and Constitutional
Development",Transcription Services,Various Service Providers,Competitive bidding process in progress,"35,356,99.10","4 22 561,95","7 044 269,93",2017/02/17,Supported,2017/03/01,2017/05/31
111,"Justice and Constitutional
Development","Travel and accommodation
management services",Flair (Pty) Ltd,Competitive bidding process in progress,"168 506 615,00","50 958 369,00","245 851 897,00",2017/02/24,Supported,2017/04/01,2017/09/30
112,Labour,Litigation support services,Sizwe Ntsaluba Gobodo,Continuity of service,"452 771,52","7 85 304,32","0,00",2017/01/16,Conditional support,Once off,Once off
113,Legal Aid,"Rental of office accommodation in
Stellenbosch Justice Centre","Abacus Property Holding & Key
Capital Property Holdings",Competitive bidding process in progress,5 772 489.40,520 459.84,361 439.14,2017/03/22,Not Supported,Not stated,Not stated
114,Legal Aid,"Rental of office accommodation in
Mafikeng Justice Centre",Edgebay Investment 9 (Pty) Ltd,Competitive bidding process in progress,1 307 657.52,"1 507 256,33",363 516.93,2017/02/20,Conditional support,Not stated,Not stated
115,Lepelle Northern Water,"Installation of 500mm Raw water
pipeline at Doorndraai Plant",TCP Bereka JV Sebushi,Extension of scope of work,"4 585 494,00","1 433 418,00","964 566,00",2017/01/26,Conditional support,2016/04/09,2017/07/29
116,Lepelle Northern Water,"Planning and design processes for the
raising of Tzaneen Dam Project",Blackhead Consulting,Extension of scope of work,"17 000 000,00","7 000 000,00","0,00",2017/02/16,Not Supported,Not stated,Not stated
117,LGSETA,"Develop QAS addendum and
Bankdata of assessment Instruments",Mr Wermart Groenewald,Continuity of service,"60 000,00","45 000,00","0,00",2017/02/17,Conditional support,2017/02/17,2017/02/03
118,LGSETA,"Maintenance and Hosting of MIS
System",Remotenet,Continuity of service,"6 134 822,36","6 097 235,76","0,00",2017/03/16,Conditional support,2017/04/01,2020/03/31
119,LGSETA,Network Infrastructure upgrade,Vox,Continuity of service,"4 079 400,00","1 849 879,22","0,00",2017/03/16,Conditional support,2017/04/01,2020/03/31
120,Mineral Resources,"Support of the SAMRAD and SAMSHA
online system",Moneo Professional Services,Single Source,"13 680,00","1 008 000,00","246 240,00",2016/10/27,Supported,2017/01/03,2020/01/04
