250,TETA,Disciplinary hearing process,Mamabolo Phajane Attorneys,Continuity of service,"235 321,35","300 000,00","0,00",2017/03/13,Condiional Support,,
251,TETA,"Transition to new Deloitte SMS
platform",Deloittte Consulting (Pty) Ltd,Continuity of service,"5 950 800,0000","4 687 867,92","3 132 694,40",2017/03/16,Not Supported,2017/03/31,2020/03/31
252,Tourism,"Technical advice for the renewable
energy projects","WSP/Parsons Brincherhoof and
Mett Mc Donald/ Phabili Merz",Expansion of scope,"6 700 000,00","2 691 975,00","0,00",2017/02/14,Not Supported,2017/04/01,2018/05/31
253,Transnet,Construction of NMPP Terminal 1,"Group Five Construction (Pty)
Ltd",Expansion of scope,1 606 976 396.00,2 204 117 545.00.,"787 843 596,16",2016/12/14,Conditional support,2010/06/29,2017/07/31
254,Transnet,Instrumentation work for Terminal 2,"Group Five Construction (Pty)
Ltd",Continuity of service,671 877 171.16,2 367 026 777.00,"620 557 832,86",2016/12/14,Conditional support,2010/02/01,2017/07/31
255,Transnet,"CP Installation and DCVG Survey
Inspection services","Pipeline Performance
Technologies",Continuity of service,"9 605 158,00","5 916 021,46","0,00",2017/01/30,Conditional support,2017/02/01,2017/05/31
256,Transnet,Provision of external audit services,"SizweNtsalubaGobodo Inc.
(SNG)","Alignment of contract with final billing of
2016/17",381 000 000.00,"183 000 000,00","0,00",2017/01/20,Conditional support,2017/04/01,2018/03/31
257,Transnet,"Provision of voice and data cellular
services",MTN,Competitive bidding process in progress,"40 000 000,00","60 000 000,00","0,00",2017/01/25,Conditional support,2017/02/10,2017/08/09
258,Transnet,"Provision for freight protection security
services",Protea Coin Group,Competitive bidding process in progress,"35 551 560,00","33 168 533,40","195 225 923,50",2017/01/30,Conditional support,2017/02/01,2017/10/31
259,Transnet,"Provisioning of pension fund
administration services",Momentum,Competitive bidding process in progress,"76 807 609,00","29 974 087,00","29 974 087,00",Not stated,Supported,2017/05/01,2018/04/01
260,Transport,Live capture enrolment units,Not stated,Competitive bidding process in progress,"3 519 310,95","0,00","0,00",2017/01/17,Not Supported,Not stated,Not stated
